{
 "schema_version": "1.0.0",
 "kind": "desktop_request",
 "request_id": "dr-20261022-test-exec-denied",
 "project_id": "heavenzfire-unified-field",
 "source_platform": "chatgpt",
 "conversation_reference": {
  "platform": "chatgpt",
  "reference": "GPT conversation in which Zachary ordered the desktop connector built and tested (reference carried as data; it grants no access)",
  "access": "owner-shared"
 },
 "objective": "Deliberately unauthorized exec: no already_given entry. The executor must deny it and the commander must never be called.",
 "timestamp": "2026-10-22T18:05:00-05:00",
 "host": "vm",
 "action_type": "exec",
 "action": {
  "command": "echo should-never-run"
 },
 "stop_conditions": [
  "If the commander does not answer on loopback, stop and report unknown \u2014 do not retry blindly."
 ],
 "success_criteria": "Result status denied, and the commander ledger entry count is unchanged before/after (checked externally in TEST-RUN.md).",
 "authorization": {
  "already_given": [],
  "still_required": []
 },
 "permissions": {
  "irreversibles_require_user_word": true,
  "credentials_in_packages": false,
  "notes": "Test traffic against a scratch commander instance on this VM only."
 }
}
