{
 "schema_version": "1.0.0",
 "kind": "desktop_request",
 "request_id": "dr-20261022-test-shot-vm",
 "project_id": "heavenzfire-unified-field",
 "source_platform": "chatgpt",
 "conversation_reference": {
  "platform": "chatgpt",
  "reference": "GPT conversation in which Zachary ordered the desktop connector built and tested (reference carried as data; it grants no access)",
  "access": "owner-shared"
 },
 "objective": "Attempt one screenshot on the headless VM host. The honest expected outcome is the commander's named 501 (no screenshot backend), recorded as failed \u2014 not a faked image.",
 "timestamp": "2026-10-22T18:05:00-05:00",
 "host": "vm",
 "action_type": "shot",
 "action": {},
 "stop_conditions": [
  "If the commander does not answer on loopback, stop and report unknown \u2014 do not retry blindly."
 ],
 "success_criteria": "Result status failed with the commander's exact 501 message in failures, and no artifact claimed.",
 "authorization": {
  "already_given": [
   {
    "action": "shot",
    "evidence": "Zachary's order in chat, 2026-10-22: build and live-test the desktop connector"
   }
  ],
  "still_required": []
 },
 "permissions": {
  "irreversibles_require_user_word": true,
  "credentials_in_packages": false,
  "notes": "Test traffic against a scratch commander instance on this VM only."
 }
}
